{
  "module_id": "efficiency.code_bloat",
  "module_kind": "G",
  "owner_plan": "P10",
  "implementation_strategy": "greenfield",
  "contract_version": "1.0.0",
  "decision_class_entry": "D2",
  "security_profile": "dev-light",
  "auth_mode": "bootstrap",
  "execution_guard": "off",
  "audit_mode": "basic",
  "depends_on": [
    "core.event_bus"
  ],
  "publishes_events": [
    "efficiency.bloat.measured",
    "efficiency.bloat.threshold"
  ],
  "consumes_events": [],
  "description": "Tracks code size, complexity, and duplication metrics.",
  "version": "1.0.0",
  "milestone": "M0",
  "lifecycle_stage": "draft"
}
