{
  "module_id": "security.profiles",
  "module_kind": "F",
  "owner_plan": "P07",
  "implementation_strategy": "greenfield",
  "contract_version": "1.0.0",
  "decision_class_entry": "D0",
  "security_profile": "staging-strict",
  "auth_mode": "bootstrap",
  "execution_guard": "off",
  "audit_mode": "basic",
  "depends_on": [],
  "publishes_events": [],
  "consumes_events": [],
  "description": "Security profile definitions for dev, test, staging, prod environments.",
  "version": "1.0.0",
  "milestone": "M0",
  "lifecycle_stage": "draft"
}
