{
  "module_id": "cognitive.feedback_collector",
  "module_kind": "B",
  "owner_plan": "P15",
  "implementation_strategy": "greenfield",
  "contract_version": "1.0.0",
  "decision_class_entry": "D3",
  "security_profile": "dev-light",
  "auth_mode": "bootstrap",
  "execution_guard": "off",
  "audit_mode": "basic",
  "depends_on": [],
  "description": "Feedback collection and processing for cognitive models.",
  "version": "1.0.0",
  "milestone": "M0",
  "lifecycle_stage": "stable"
}