{
  "module_id": "core.rollback_manager",
  "module_kind": "A",
  "owner_plan": "P14",
  "implementation_strategy": "greenfield",
  "contract_version": "1.0.0",
  "decision_class_entry": "D3",
  "security_profile": "dev-light",
  "auth_mode": "bootstrap",
  "execution_guard": "off",
  "audit_mode": "basic",
  "depends_on": [],
  "description": "Rollback manager for reversibility and recovery.",
  "version": "1.0.0",
  "milestone": "M0",
  "lifecycle_stage": "stable"
}