{
  "module_id": "skills.registry",
  "module_kind": "I",
  "owner_plan": "P15",
  "implementation_strategy": "greenfield",
  "contract_version": "1.0.0",
  "decision_class_entry": "D2",
  "security_profile": "dev-light",
  "auth_mode": "bootstrap",
  "execution_guard": "off",
  "audit_mode": "basic",
  "depends_on": [
    "core.event_bus"
  ],
  "publishes_events": [
    "skills.skill.registered",
    "skills.skill.deregistered"
  ],
  "consumes_events": [],
  "description": "Registry of available skills with metadata and versioning.",
  "version": "1.0.0",
  "milestone": "M0",
  "lifecycle_stage": "draft"
}
