{
  "module_id": "cognitive.code_agent",
  "module_kind": "B",
  "owner_plan": "P01",
  "implementation_strategy": "greenfield",
  "contract_version": "1.0.0",
  "decision_class_entry": "D3",
  "security_profile": "dev-light",
  "auth_mode": "bootstrap",
  "execution_guard": "off",
  "audit_mode": "basic",
  "depends_on": [
    "core.event_bus"
  ],
  "publishes_events": [
    "cognitive.code.generated",
    "cognitive.code.executed"
  ],
  "consumes_events": [
    "cognitive.plan.created",
    "security.guard.allowed"
  ],
  "description": "Autonomous code generation and modification agent with sandbox execution.",
  "version": "1.0.0",
  "milestone": "M0",
  "lifecycle_stage": "draft"
}
