{
  "module_id": "cognitive.agent_runtime",
  "module_kind": "B",
  "owner_plan": "P06",
  "implementation_strategy": "greenfield",
  "contract_version": "1.0.0",
  "decision_class_entry": "D3",
  "security_profile": "dev-light",
  "auth_mode": "bootstrap",
  "execution_guard": "off",
  "audit_mode": "basic",
  "depends_on": [],
  "description": "Agent runtime environment for executing autonomous agents.",
  "version": "1.0.0",
  "milestone": "M0",
  "lifecycle_stage": "stable"
}