{
  "module_id": "memory.retrieval",
  "module_kind": "D",
  "owner_plan": "P12",
  "implementation_strategy": "greenfield",
  "contract_version": "1.0.0",
  "decision_class_entry": "D2",
  "security_profile": "dev-light",
  "auth_mode": "bootstrap",
  "execution_guard": "off",
  "audit_mode": "basic",
  "depends_on": [
    "core.event_bus",
    "memory.indexer"
  ],
  "publishes_events": [
    "memory.retrieval.query",
    "memory.retrieval.result"
  ],
  "consumes_events": [],
  "description": "Unified retrieval interface combining keyword, semantic, and graph search.",
  "version": "1.0.0",
  "milestone": "M0",
  "lifecycle_stage": "draft"
}
