{
  "module_id": "devices.device_discovery",
  "module_kind": "M",
  "owner_plan": "P19",
  "implementation_strategy": "greenfield",
  "contract_version": "1.0.0",
  "decision_class_entry": "D2",
  "security_profile": "dev-light",
  "auth_mode": "bootstrap",
  "execution_guard": "off",
  "audit_mode": "basic",
  "depends_on": [
    "core.event_bus"
  ],
  "publishes_events": [
    "devices.discovery.found",
    "devices.discovery.lost"
  ],
  "consumes_events": [],
  "description": "Discovers devices on the network via multiple protocols.",
  "version": "1.0.0",
  "milestone": "M0",
  "lifecycle_stage": "draft"
}
