{
  "module_id": "security.hardened_audit",
  "module_kind": "F",
  "owner_plan": "P08",
  "implementation_strategy": "greenfield",
  "contract_version": "1.0.0",
  "decision_class_entry": "D3",
  "security_profile": "dev-light",
  "auth_mode": "bootstrap",
  "execution_guard": "off",
  "audit_mode": "basic",
  "depends_on": [],
  "description": "Hardened audit profiles for strict compliance.",
  "version": "1.0.0",
  "milestone": "M0",
  "lifecycle_stage": "stable"
}