{
  "module_id": "governance.decision_snapshot",
  "module_kind": "E",
  "owner_plan": "P05",
  "implementation_strategy": "greenfield",
  "contract_version": "1.0.0",
  "decision_class_entry": "D3",
  "security_profile": "dev-light",
  "auth_mode": "bootstrap",
  "execution_guard": "off",
  "audit_mode": "basic",
  "depends_on": [],
  "description": "Decision snapshot capture and audit trail.",
  "version": "1.0.0",
  "milestone": "M0",
  "lifecycle_stage": "stable"
}